😀	инээсэн царай, инээх, царай
😃	ам, амаа ангайлган инээж буй царай, ангайлгах, инээх, царай
😄	ам, амаа ангайлган нүдээ онийлгон инээж буй царай, ангайлгах, инээх, нүдээ онийлгон маасайтал инээсэн царай, нүдээ онийлгох, царай
😁	инээх, нүд, нүдээ онийлгон инээсэн царай, онийлгох, царай
😆	ам, амаа ангайлган нүдээ тас аниад инээж байгаа царай, ангайлгах, инээх, нүд, нүдээ тас аниж маасайтал инээсэн царай, тас аних, царай
😅	амаа ангайн, амаа ангайн, бага зэргийн ичиж инээсэн царай, бага зэргийн ичиж инээж байгаа царай, хөлсөө гартал маасайтал инээсэн царай
🤣	газар, инээж, газар өнхрөх царай, инээх, царай, өнхрөх
😂	инээх, нулимс гарах, нулимсаа гартал инээж буй царай, царай
🙂	бага зэрэг, бага зэрэг инээмсэглэсэн царай, инээмсэглэх, царай
🙃	доошоо харсан царай, уруу харсан царай
😉	ирмэж байгаа царай, ирмэх, царай
😊	инээмсэглэх, ичингүйрэх, онийж инээмсэглэсэн царай, царай
😇	инээмсэглэж буй сахиусан тэнгэрийн царай, инээмсэглэх, сахиусан тэнгэр, царай
🥰	дурлал, инээж буй зүрхтэй царай, шохоорхол, шүтэх
😍	бундан, бундан нүдтэй инээмсэглэж байгаа царай, инээмсэглэх, нүд, царай
🤩	инээх, нүд, од, одон нүдтэй инээж буй царай, царай
😘	зүрх, царай, үнсэлт, үнсэлт илгээж байгаа царай
😗	царай, үнсэж байгаа царай, үнсэх
☺️	ичингүйрсэн инээмсэглэл, ичингүйрэн инээмсэглэж байгаа царай
😚	ичингүйрэн үнсэж байгаа царай, ичингүйрэх, царай, үнсэх
😙	аних, нүд, нүдээ аниад үнсэж байгаа царай, царай, үнсэх
😋	амттай, амттай хоол илэрхийлсэн царай, хоол, царай
😛	гаргах, хэл, хэлээ гаргаж буй царай, царай
😜	гаргах, ирмэх, нүд, хэл, хэлээ гаргаад, нүдээ ирмэж буй царай, царай
🤪	галзуу царай, жижиг, нүд, том
😝	гаргах, нүд, тас аних, хэл, хэлээ гаргаад, нүдээ тас аньсан царай, царай
🤑	ам, амандаа мөнгөтэй царай, мөнгөтэй, царай
🤗	тэврэх, тэвэрч байгаа царай, царай
🤭	амаа гараараа тагласан царай, дуу алдах
🤫	чимээгүй, чишш, чишш гэсэн царай
🤔	бодож байгаа царай, бодох, царай
🤐	амаа үдсэн, амаа үдсэн царай, царай
🤨	хөмсгөө өргөсөн царай, эргэлзээ, үл итгэх
😐️	төвийг сахисан царай, төвийг сахих, царай
😑	илрэлгүй, сэтгэл хөдлөл, сэтгэл хөдлөлийн илрэлгүй царай, царай
😶	амгүй, амгүй царай, царай
😏	царай, ёжтой, ёжтой царай
😒	царай, үл тоосон, үл тоосон царай
🙄	нүд, нүдээ эргэлдүүлэх царай, царай, эргэлдсэн
😬	царай, ярвалзсан, ярвалзсан царай
🤥	пиноккио, худалч, худалч царай, царай
😌	тайвширсан царай, тайвшрах, царай
😔	гомдсон, гомдсон царай, царай
😪	нойрмоглож буй царай, нойрмоглох, царай
🤤	унжгар, унжгар царай, царай
😴	унтаж буй царай, унтах, царай
😷	зүүсэн, маск, маск зүүсэн царай, царай
🤒	халуунтай, халуунтай байгаа царай, царай
🤕	зүүсэн, толгой, толгойндоо шархны боолт зүүсэн царай, царай, шархны боолт
🤢	дурамжхан, дурамжхан царай, царай
🤮	бөөлжих, бөөлжсөн царай, өвчтэй
🤧	найтаах, найтаах царай, царай
🥵	наранд цохиулсан, улайсан царай, халуун, халуунтай, халууцсан царай
🥶	даарсан, даарсан царай, унжсан мөс, хүйтэн, хөлдсөн, хөхөрсөн царай
🥴	толгой эргэсэн царай, толгой эргэх, том жижиг нүд, халамцуу, хордоогүй, хэл яриа ороолдсон
😵	толгой нь эргэсэн, толгой нь эргэсэн царай, царай
🤯	толгой дэлбэрэх, цочирдсон
🤠	ковбой, ковбой малгайтай царай, малгай, охин, царай
🥳	баяр тэмдэглэх, малгай, үдэшлэг, үдэшлэг дээр баярлаж буй царай, үлээх
😎	зүүх, инээмсэглэх, нарны шил, нарны шил зүүж инээмсэглэсэн царай, царай
🤓	ухаантай, ухаантай царай, царай
🧐	бүгчим, нэг нүдний нүдний шил зүүсэн царай
😕	царай, эргэлзсэн, эргэлзсэн царай
😟	санаа зовсон, санаа зовсон царай, царай
🙁	бага зэрэг, бага зэрэг барайсан царай, барайсан, царай
☹️	баргар, баргар царай, царай
😮	царай, цочирдох, цочирдсон царай
😯	гайхширсан, гайхширсан царай, царай
😲	мэл гайхсан, мэл гайхсан царай, царай
😳	ичсэн, ичсэн царай, царай, ягаарсан
🥺	гуйх, ямар нэг юм хүсч буй царай, өршөөх, өрөвдөлтэй нүд
😦	гайхсан, гайхсан дурамжхан царай, дурамжхан, царай
😧	царай, шаналсан, шаналсан царай
😨	айсан, айсан царай, царай
😰	амаа ангайж, хүйтэн хөлс чахарсан царай, амаа ангайх, хүйтэн, хөлс чахрах, царай
😥	тайвширсан, урам хугарсан, урам хугарсан ч тайвширсан царай, царай
😢	уйлж байгаа, уйлж байгаа царай, царай
😭	уйлaх, царай, цурхиран уйлж байгаа царай, цурхирах
😱	айгаад орилж байгаа царай, айх, орилох, царай
😖	будилсан, будилсан царай, царай
😣	царай, цөхрөлтгүй, цөхрөлтгүй царай
😞	урам хугарсан, урам хугарсан царай, царай
😓	хүйтэн, хүйтэн хөлс даасан царай, хөлс даах, царай
😩	залхсан, залхсан царай, царай
😫	царай, ядарсан, ядарсан царай
🥱	уйдсан, эвшээж буй царай, эвшээх, ядарсан
😤	их, их уурласан царай, уурласан, царай
😡	маш их уурласан царай, улайсан, уурласан, царай
😠	ууртай, ууртай царай, уцаартай, царай
🤬	тэмдэгтүүд амандаа зуусан царай, хөлөрч байна
😈	хорноор инээж байгаа царай, хорноор инээх, царай
👿	ууртай, царай, чөтгөр
💀	аймшиг, гавал, үхэл
☠️	аюул, гавал, гавлын яс, яс, үхэл
💩	баас, овоолсон, овоолсон баас
🤡	алиалагч, алиалагчийн царай, царай
👹	аварга, аварга махчин, махчин
👺	мангас, онгод, төсөөлөл, шүтээн, шүтээн, онгод, япон
👻	аймшиг, сүнс, үхэл
👽️	амьтан, дам яриа, сансар, төсөөлөл, харь гариг, харь гаригийн амьтан, үлгэр домог
👾	дам яриа, мангас, сансар, төсөөлөл, харь гариг, харь гаригийн мангас, үлгэр
🤖	робот, робот царай, царай
😺	ам, амаа ангайгаад инээж байгаа, амаа ангайгаад инээж байгаа муур, ангайх, инээсэн, муур, царай
😸	инээх, муур, нүд, нүдээрээ инээж байгаа муур, нүдээрээ инээж байгаа ︱царай
😹	баярлах, муур, нулимс, нулимсаа гартал инээж байгаа муур, царай
😻	дурлал, зүрх, зүрхэн нүдтэй инээж байгаа муур, инээх, муур, нүд, царай
😼	жоготой, жоготой инээмсэглэж байгаа муур, инээх, муур, царай, ёжтой
😽	муур, нүд, нүдээ аниад үнсэж байгаа муур, царай, үнсэх
🙀	гайхшралд орох, гайхшралд орсон муур, муур
😿	гунигтай, муур, нулимс, уйлах, уйлж байгаа муур
😾	муур, урвагар, урвагар царайлсан муур, царайлах
🙈	дарах, дохио зангаа, итгэл үнэмшил, муу, муу үйлийг харахгүй, нуугдах, нүд, сармагчин, харахгүй, үйл
🙉	дарах, итгэл үнэмшил, муу, муу үйлийг сонсохгүй, сармагчин, сонсохгүй, чих, үйл
🙊	ам, дарах, итгэл үнэмшил, муу, муу үйлийг хэлэхгүй, сармагчин, хэлэхгүй, үйл
💋	уруул, хайр дурлал, ягаан, үнсэлтийн мөр, үнсэх
💌	дугтуй, захиа, хайр, хайрын захиа
💘	зүрх, сум, сумаар харвасан зүрх, харвах
💝	баантаг, баантагтай зүрх, зүрх
💖	гялалзаж байгаа зүрх, гялалзах, дурлал, зүрх
💗	зүрх, зүрхний цохилт, нэмэгдэж байгаа зүрх, нэмэгдэх, сандрал
💓	зүрх, зүрхний цохилт, цохилж буй зүрх, цохилох, ягаан
💞	зүрх, эргэлдэж буй зүрх, эргэлдэх
💕	зүрх, хайр дурлал, хоёр, хоёр зүрх
💟	зүрх, зүрхэн чимэглэл, чимэглэл
❣️	анхааруулга, зүрх, зүрхэн хэлбэртэй анхааруулгын тэмдэг, тэмдэг, хэлбэр
💔	зүрх, шархалсан зүрх, шархлах
❤️	зүрх, улаан, улаан зүрх, хайр
🧡	улбар шар, улбар шар зүрх
💛	зүрх, шар, шар зүрх
💚	зүрх, ногоон, ногоон зүрх
💙	зүрх, цэнхэр, цэнхэр зүрх
💜	зүрх, нил ягаан, нил ягаан зүрх
🤎	зүрх, хүрэн, хүрэн зүрх
🖤	зүрх, хар, хар зүрх
🤍	зүрх, цагаан, цагаан зүрх
💯	дээд, зуу, зуун оноо, оноо
💢	дүрслэл, уурлаж байгаа дүрслэл, уурлах
💥	зурагт ном, мөргөлдөөн, тэсрэлт
💫	од, төөрөгдүүлсэн, төөрөгдүүлэх
💦	дусал, хөлс, хөлсний дусал
💨	гүйж байгаа, эрч хүч, эрч хүчтэй
🕳️	нүх
💣️	бөмбөг, тэсрэх, тэсрэх бөмбөг
💬	төсөөлөл, шаар, яриа, ярианы хэсэг
👁‍🗨	гэрч, нүд, ярианы хөөс, ярианы хөөсөн доторх нүд
🗨️	зүүн, зүүн талын ярианы хэсэг, тал, хэсэг, яриа
🗯️	баруун, баруун талын ууртай ярианы хэсэг, бөмбөлөг, уурны хөөс, ууртай, уцаартай, хөөс
💭	бодож байгаа бөмбөлөг, бодох, бөмбөлөг
💤	төсөөлөл, унтаж байгаа, унтах
👋	алга, гар, мэндчилж байгаа гар, мэндчлэх, хуруу
👋🏻	алга, гар, мэндчилж байгаа гар, мэндчилж байгаа гар: цайвар, мэндчлэх, хуруу, цайвар
👋🏼	алга, бага зэргийн цайвар, гар, мэндчилж байгаа гар, мэндчилж байгаа гар: бага зэргийн цайвар, мэндчлэх, хуруу
👋🏽	алга, гар, дунд зэргийн, мэндчилж байгаа гар, мэндчилж байгаа гар: дунд зэргийн, мэндчлэх, хуруу
👋🏾	алга, бордуу, гар, мэндчилж байгаа гар, мэндчилж байгаа гар: бордуу, мэндчлэх, хуруу
👋🏿	алга, бор, гар, мэндчилж байгаа гар, мэндчилж байгаа гар: бор, мэндчлэх, хуруу
🤚	ар, гарын, өргөсөн, өргөсөн гарын ар
🤚🏻	ар, гарын, цайвар, өргөсөн, өргөсөн гарын ар: цайвар
🤚🏼	ар, бага зэргийн цайвар, гарын, өргөсөн, өргөсөн гарын ар: бага зэргийн цайвар
🤚🏽	ар, гарын, дунд зэргийн, өргөсөн, өргөсөн гарын ар: дунд зэргийн
🤚🏾	ар, бордуу, гарын, өргөсөн, өргөсөн гарын ар: бордуу
🤚🏿	ар, бор, гарын, өргөсөн, өргөсөн гарын ар: бор
🖐️	гар, салгах, хуруу, хуруунуудаа салгасан гар, хуруунуудаа салгасан гарын алга
🖐🏻	гар, салгах, хуруу, хуруунуудаа салгасан гар, хуруунуудаа салгасан гарын алга, хуруунуудаа салгасан гарын алга: цайвар, цайвар
🖐🏼	бага зэргийн цайвар, гар, салгах, хуруу, хуруунуудаа салгасан гар, хуруунуудаа салгасан гарын алга, хуруунуудаа салгасан гарын алга: бага зэргийн цайвар
🖐🏽	гар, дунд зэргийн, салгах, хуруу, хуруунуудаа салгасан гар, хуруунуудаа салгасан гарын алга, хуруунуудаа салгасан гарын алга: дунд зэргийн
🖐🏾	бордуу, гар, салгах, хуруу, хуруунуудаа салгасан гар, хуруунуудаа салгасан гарын алга, хуруунуудаа салгасан гарын алга: бордуу
🖐🏿	бор, гар, салгах, хуруу, хуруунуудаа салгасан гар, хуруунуудаа салгасан гарын алга, хуруунуудаа салгасан гарын алга: бор
✋	гар, өргөсөн гар, өргөх
✋🏻	гар, цайвар, өргөсөн гар, өргөсөн гар: цайвар, өргөх
✋🏼	бага зэргийн цайвар, гар, өргөсөн гар, өргөсөн гар: бага зэргийн цайвар, өргөх
✋🏽	гар, дунд зэргийн, өргөсөн гар, өргөсөн гар: дунд зэргийн, өргөх
✋🏾	бордуу, гар, өргөсөн гар, өргөсөн гар: бордуу, өргөх
✋🏿	бор, гар, өргөсөн гар, өргөсөн гар: бор, өргөх
🖖	вулкан, вулкан мэндчилгээ, гар, дохио зангаа, мэндчилгээ
🖖🏻	вулкан, вулкан мэндчилгээ: цайвар, гар, дохио зангаа, мэндчилгээ, цайвар
🖖🏼	бага зэргийн цайвар, вулкан, вулкан мэндчилгээ: бага зэргийн цайвар, гар, дохио зангаа, мэндчилгээ
🖖🏽	вулкан, вулкан мэндчилгээ: дунд зэргийн, гар, дохио зангаа, дунд зэргийн, мэндчилгээ
🖖🏾	бордуу, вулкан, вулкан мэндчилгээ: бордуу, гар, дохио зангаа, мэндчилгээ
🖖🏿	бор, вулкан, вулкан мэндчилгээ: бор, гар, дохио зангаа, мэндчилгээ
👌	гар, дохио зангаа, ок
👌🏻	гар, дохио зангаа, ок, ок: цайвар, цайвар
👌🏼	бага зэргийн цайвар, гар, дохио зангаа, ок, ок: бага зэргийн цайвар
👌🏽	гар, дохио зангаа, дунд зэргийн, ок, ок: дунд зэргийн
👌🏾	бордуу, гар, дохио зангаа, ок, ок: бордуу
👌🏿	бор, гар, дохио зангаа, ок, ок: бор
🤏	бага зэрэг, чимхэж буй гар
🤏🏻	бага зэрэг, цайвар, чимхэж буй гар, чимхэж буй гар: цайвар
🤏🏼	бага зэргийн цайвар, бага зэрэг, чимхэж буй гар, чимхэж буй гар: бага зэргийн цайвар
🤏🏽	бага зэрэг, дунд зэргийн, чимхэж буй гар, чимхэж буй гар: дунд зэргийн
🤏🏾	бага зэрэг, бордуу, чимхэж буй гар, чимхэж буй гар: бордуу
🤏🏿	бага зэрэг, бор, чимхэж буй гар, чимхэж буй гар: бор
✌️	v, амжилт, амжилт хүссэн гар, гар
✌🏻	v, амжилт, амжилт хүссэн гар, амжилт хүссэн гар: цайвар, гар, цайвар
✌🏼	v, амжилт, амжилт хүссэн гар, амжилт хүссэн гар: бага зэргийн цайвар, бага зэргийн цайвар, гар
✌🏽	v, амжилт, амжилт хүссэн гар, амжилт хүссэн гар: дунд зэргийн, гар, дунд зэргийн
✌🏾	v, амжилт, амжилт хүссэн гар, амжилт хүссэн гар: бордуу, бордуу, гар
✌🏿	v, амжилт, амжилт хүссэн гар, амжилт хүссэн гар: бор, бор, гар
🤞	солбисон, солбисон хуруу, хуруу
🤞🏻	солбисон, солбисон хуруу: цайвар, хуруу, цайвар
🤞🏼	бага зэргийн цайвар, солбисон, солбисон хуруу: бага зэргийн цайвар, хуруу
🤞🏽	дунд зэргийн, солбисон, солбисон хуруу: дунд зэргийн, хуруу
🤞🏾	бордуу, солбисон, солбисон хуруу: бордуу, хуруу
🤞🏿	бор, солбисон, солбисон хуруу: бор, хуруу
🤟	БЧХ, гар, хайртай гэсэн дохир
🤟🏻	БЧХ, гар, хайртай гэсэн дохир, хайртай гэсэн дохир: цайвар, цайвар
🤟🏼	БЧХ, бага зэргийн цайвар, гар, хайртай гэсэн дохир, хайртай гэсэн дохир: бага зэргийн цайвар
🤟🏽	БЧХ, гар, дунд зэргийн, хайртай гэсэн дохир, хайртай гэсэн дохир: дунд зэргийн
🤟🏾	БЧХ, бордуу, гар, хайртай гэсэн дохир, хайртай гэсэн дохир: бордуу
🤟🏿	БЧХ, бор, гар, хайртай гэсэн дохир, хайртай гэсэн дохир: бор
🤘	гар, рок, хуруу, эвэр, эвэрний тэмдэг
🤘🏻	гар, рок, хуруу, цайвар, эвэр, эвэрний тэмдэг, эвэрний тэмдэг: цайвар
🤘🏼	бага зэргийн цайвар, гар, рок, хуруу, эвэр, эвэрний тэмдэг, эвэрний тэмдэг: бага зэргийн цайвар
🤘🏽	гар, дунд зэргийн, рок, хуруу, эвэр, эвэрний тэмдэг, эвэрний тэмдэг: дунд зэргийн
🤘🏾	бордуу, гар, рок, хуруу, эвэр, эвэрний тэмдэг, эвэрний тэмдэг: бордуу
🤘🏿	бор, гар, рок, хуруу, эвэр, эвэрний тэмдэг, эвэрний тэмдэг: бор
🤙	дохио, залгаарай, залгаарай дохио
🤙🏻	дохио, залгаарай, залгаарай дохио: цайвар, цайвар
🤙🏼	бага зэргийн цайвар, дохио, залгаарай, залгаарай дохио: бага зэргийн цайвар
🤙🏽	дохио, дунд зэргийн, залгаарай, залгаарай дохио: дунд зэргийн
🤙🏾	бордуу, дохио, залгаарай, залгаарай дохио: бордуу
🤙🏿	бор, дохио, залгаарай, залгаарай дохио: бор
👈️	гар, гарын ар тал, долоовор хуруугаараа зүүн тийш зааж буй гар, зүүн зүг зааж байгаа, хуруу
👈🏻	гар, гарын ар тал, долоовор хуруугаараа зүүн тийш зааж буй гар, зүүн зүг зааж байгаа, зүүн зүг зааж байгаа: цайвар, хуруу, цайвар
👈🏼	бага зэргийн цайвар, гар, гарын ар тал, долоовор хуруугаараа зүүн тийш зааж буй гар, зүүн зүг зааж байгаа, зүүн зүг зааж байгаа: бага зэргийн цайвар, хуруу
👈🏽	гар, гарын ар тал, долоовор хуруугаараа зүүн тийш зааж буй гар, дунд зэргийн, зүүн зүг зааж байгаа, зүүн зүг зааж байгаа: дунд зэргийн, хуруу
👈🏾	бордуу, гар, гарын ар тал, долоовор хуруугаараа зүүн тийш зааж буй гар, зүүн зүг зааж байгаа, зүүн зүг зааж байгаа: бордуу, хуруу
👈🏿	бор, гар, гарын ар тал, долоовор хуруугаараа зүүн тийш зааж буй гар, зүүн зүг зааж байгаа, зүүн зүг зааж байгаа: бор, хуруу
👉️	баруун зүг зааж байгаа, баруун тийш зааж буй долоовор хуруу, гар, гарын ар тал, хуруу
👉🏻	баруун зүг зааж байгаа, баруун зүг зааж байгаа: цайвар, баруун тийш зааж буй долоовор хуруу, гар, гарын ар тал, хуруу, цайвар
👉🏼	бага зэргийн цайвар, баруун зүг зааж байгаа, баруун зүг зааж байгаа: бага зэргийн цайвар, баруун тийш зааж буй долоовор хуруу, гар, гарын ар тал, хуруу
👉🏽	баруун зүг зааж байгаа, баруун зүг зааж байгаа: дунд зэргийн, баруун тийш зааж буй долоовор хуруу, гар, гарын ар тал, дунд зэргийн, хуруу
👉🏾	баруун зүг зааж байгаа, баруун зүг зааж байгаа: бордуу, баруун тийш зааж буй долоовор хуруу, бордуу, гар, гарын ар тал, хуруу
👉🏿	баруун зүг зааж байгаа, баруун зүг зааж байгаа: бор, баруун тийш зааж буй долоовор хуруу, бор, гар, гарын ар тал, хуруу
👆️	гар, гарын ар тал, дээшээ зааж буй алганы ар тал, дээшээ зааж буй долоовор хуруу, хуруу
👆🏻	гар, гарын ар тал, дээшээ зааж буй алганы ар тал, дээшээ зааж буй алганы ар тал: цайвар, дээшээ зааж буй долоовор хуруу, хуруу, цайвар
👆🏼	бага зэргийн цайвар, гар, гарын ар тал, дээшээ зааж буй алганы ар тал, дээшээ зааж буй алганы ар тал: бага зэргийн цайвар, дээшээ зааж буй долоовор хуруу, хуруу
