👨🏾‍🤝‍👨🏻	бордуу, ихрүүд, хосууд, хоёр эрэгтэй, хөтлөлцсөн хоёр эрэгтэй, хөтлөлцсөн хоёр эрэгтэй: бордуу, цайвар, хөтлөлцөх, цайвар
👨🏾‍🤝‍👨🏼	бага зэргийн цайвар, бордуу, ихрүүд, хосууд, хоёр эрэгтэй, хөтлөлцсөн хоёр эрэгтэй, хөтлөлцсөн хоёр эрэгтэй: бордуу, бага зэргийн цайвар, хөтлөлцөх
👨🏾‍🤝‍👨🏽	бордуу, дунд зэргийн, ихрүүд, хосууд, хоёр эрэгтэй, хөтлөлцсөн хоёр эрэгтэй, хөтлөлцсөн хоёр эрэгтэй: бордуу, дунд зэргийн, хөтлөлцөх
👬🏾	бордуу, ихрүүд, хосууд, хоёр эрэгтэй, хөтлөлцсөн хоёр эрэгтэй, хөтлөлцсөн хоёр эрэгтэй: бордуу, хөтлөлцөх
👨🏿‍🤝‍👨🏻	бор, ихрүүд, хосууд, хоёр эрэгтэй, хөтлөлцсөн хоёр эрэгтэй, хөтлөлцсөн хоёр эрэгтэй: бор, цайвар, хөтлөлцөх, цайвар
👨🏿‍🤝‍👨🏼	бага зэргийн цайвар, бор, ихрүүд, хосууд, хоёр эрэгтэй, хөтлөлцсөн хоёр эрэгтэй, хөтлөлцсөн хоёр эрэгтэй: бор, бага зэргийн цайвар, хөтлөлцөх
👨🏿‍🤝‍👨🏽	бор, дунд зэргийн, ихрүүд, хосууд, хоёр эрэгтэй, хөтлөлцсөн хоёр эрэгтэй, хөтлөлцсөн хоёр эрэгтэй: бор, дунд зэргийн, хөтлөлцөх
👨🏿‍🤝‍👨🏾	бор, бордуу, ихрүүд, хосууд, хоёр эрэгтэй, хөтлөлцсөн хоёр эрэгтэй, хөтлөлцсөн хоёр эрэгтэй: бор, бордуу, хөтлөлцөх
👬🏿	бор, ихрүүд, хосууд, хоёр эрэгтэй, хөтлөлцсөн хоёр эрэгтэй, хөтлөлцсөн хоёр эрэгтэй: бор, хөтлөлцөх
💏	хос, үнсэлт
👩‍❤‍💋‍👨	хос, эмэгтэй хүн, эрэгтэй хүн, үнсэлт, үнсэлт: эмэгтэй хүн, эрэгтэй хүн
👨‍❤‍💋‍👨	хос, эрэгтэй хүн, үнсэлт, үнсэлт: эрэгтэй хүн, эрэгтэй хүн
👩‍❤‍💋‍👩	хос, эмэгтэй хүн, үнсэлт, үнсэлт: эмэгтэй хүн, эмэгтэй хүн
💑	дунд, дундаа зүрхтэй хосууд, зүрх, хайр, хос
👩‍❤‍👨	дунд, дундаа зүрхтэй хосууд, дундаа зүрхтэй хосууд: эмэгтэй хүн, эрэгтэй хүн, зүрх, хайр, хос, эмэгтэй хүн, эрэгтэй хүн
👨‍❤‍👨	дунд, дундаа зүрхтэй хосууд, дундаа зүрхтэй хосууд: эрэгтэй хүн, эрэгтэй хүн, зүрх, хайр, хос, эрэгтэй хүн
👩‍❤‍👩	дунд, дундаа зүрхтэй хосууд, дундаа зүрхтэй хосууд: эмэгтэй хүн, эмэгтэй хүн, зүрх, хайр, хос, эмэгтэй хүн
👪️	аав, гэр бүл, хүү, ээж
👨‍👩‍👦	аав, гэр бүл, гэр бүл: эрэгтэй хүн, эмэгтэй хүн, эрэгтэй хүүхэд, хүү, эмэгтэй хүн, эрэгтэй хүн, эрэгтэй хүүхэд, ээж
👨‍👩‍👧	аав, гэр бүл, гэр бүл: эрэгтэй хүн, эмэгтэй хүн, эмэгтэй хүүхэд, хүү, эмэгтэй хүн, эмэгтэй хүүхэд, эрэгтэй хүн, ээж
👨‍👩‍👧‍👦	аав, гэр бүл, гэр бүл: эрэгтэй хүн, эмэгтэй хүн, эмэгтэй хүүхэд, эрэгтэй хүүхэд, хүү, эмэгтэй хүн, эмэгтэй хүүхэд, эрэгтэй хүн, эрэгтэй хүүхэд, ээж
👨‍👩‍👦‍👦	аав, гэр бүл, гэр бүл: эрэгтэй хүн, эмэгтэй хүн, эрэгтэй хүүхэд, эрэгтэй хүүхэд, хүү, эмэгтэй хүн, эрэгтэй хүн, эрэгтэй хүүхэд, ээж
👨‍👩‍👧‍👧	аав, гэр бүл, гэр бүл: эрэгтэй хүн, эмэгтэй хүн, эмэгтэй хүүхэд, эмэгтэй хүүхэд, хүү, эмэгтэй хүн, эмэгтэй хүүхэд, эрэгтэй хүн, ээж
👨‍👨‍👦	аав, гэр бүл, гэр бүл: эрэгтэй хүн, эрэгтэй хүн, эрэгтэй хүүхэд, хүү, эрэгтэй хүн, эрэгтэй хүүхэд, ээж
👨‍👨‍👧	аав, гэр бүл, гэр бүл: эрэгтэй хүн, эрэгтэй хүн, эмэгтэй хүүхэд, хүү, эмэгтэй хүүхэд, эрэгтэй хүн, ээж
👨‍👨‍👧‍👦	аав, гэр бүл, гэр бүл: эрэгтэй хүн, эрэгтэй хүн, эмэгтэй хүүхэд, эрэгтэй хүүхэд, хүү, эмэгтэй хүүхэд, эрэгтэй хүн, эрэгтэй хүүхэд, ээж
👨‍👨‍👦‍👦	аав, гэр бүл, гэр бүл: эрэгтэй хүн, эрэгтэй хүн, эрэгтэй хүүхэд, эрэгтэй хүүхэд, хүү, эрэгтэй хүн, эрэгтэй хүүхэд, ээж
👨‍👨‍👧‍👧	аав, гэр бүл, гэр бүл: эрэгтэй хүн, эрэгтэй хүн, эмэгтэй хүүхэд, эмэгтэй хүүхэд, хүү, эмэгтэй хүүхэд, эрэгтэй хүн, ээж
👩‍👩‍👦	аав, гэр бүл, гэр бүл: эмэгтэй хүн, эмэгтэй хүн, эрэгтэй хүүхэд, хүү, эмэгтэй хүн, эрэгтэй хүүхэд, ээж
👩‍👩‍👧	аав, гэр бүл, гэр бүл: эмэгтэй хүн, эмэгтэй хүн, эмэгтэй хүүхэд, хүү, эмэгтэй хүн, эмэгтэй хүүхэд, ээж
👩‍👩‍👧‍👦	аав, гэр бүл, гэр бүл: эмэгтэй хүн, эмэгтэй хүн, эмэгтэй хүүхэд, эрэгтэй хүүхэд, хүү, эмэгтэй хүн, эмэгтэй хүүхэд, эрэгтэй хүүхэд, ээж
👩‍👩‍👦‍👦	аав, гэр бүл, гэр бүл: эмэгтэй хүн, эмэгтэй хүн, эрэгтэй хүүхэд, эрэгтэй хүүхэд, хүү, эмэгтэй хүн, эрэгтэй хүүхэд, ээж
👩‍👩‍👧‍👧	аав, гэр бүл, гэр бүл: эмэгтэй хүн, эмэгтэй хүн, эмэгтэй хүүхэд, эмэгтэй хүүхэд, хүү, эмэгтэй хүн, эмэгтэй хүүхэд, ээж
👨‍👦	аав, гэр бүл, гэр бүл: эрэгтэй хүн, эрэгтэй хүүхэд, хүү, эрэгтэй хүн, эрэгтэй хүүхэд, ээж
👨‍👦‍👦	аав, гэр бүл, гэр бүл: эрэгтэй хүн, эрэгтэй хүүхэд, эрэгтэй хүүхэд, хүү, эрэгтэй хүн, эрэгтэй хүүхэд, ээж
👨‍👧	аав, гэр бүл, гэр бүл: эрэгтэй хүн, эмэгтэй хүүхэд, хүү, эмэгтэй хүүхэд, эрэгтэй хүн, ээж
👨‍👧‍👦	аав, гэр бүл, гэр бүл: эрэгтэй хүн, эмэгтэй хүүхэд, эрэгтэй хүүхэд, хүү, эмэгтэй хүүхэд, эрэгтэй хүн, эрэгтэй хүүхэд, ээж
👨‍👧‍👧	аав, гэр бүл, гэр бүл: эрэгтэй хүн, эмэгтэй хүүхэд, эмэгтэй хүүхэд, хүү, эмэгтэй хүүхэд, эрэгтэй хүн, ээж
👩‍👦	аав, гэр бүл, гэр бүл: эмэгтэй хүн, эрэгтэй хүүхэд, хүү, эмэгтэй хүн, эрэгтэй хүүхэд, ээж
👩‍👦‍👦	аав, гэр бүл, гэр бүл: эмэгтэй хүн, эрэгтэй хүүхэд, эрэгтэй хүүхэд, хүү, эмэгтэй хүн, эрэгтэй хүүхэд, ээж
👩‍👧	аав, гэр бүл, гэр бүл: эмэгтэй хүн, эмэгтэй хүүхэд, хүү, эмэгтэй хүн, эмэгтэй хүүхэд, ээж
👩‍👧‍👦	аав, гэр бүл, гэр бүл: эмэгтэй хүн, эмэгтэй хүүхэд, эрэгтэй хүүхэд, хүү, эмэгтэй хүн, эмэгтэй хүүхэд, эрэгтэй хүүхэд, ээж
👩‍👧‍👧	аав, гэр бүл, гэр бүл: эмэгтэй хүн, эмэгтэй хүүхэд, эмэгтэй хүүхэд, хүү, эмэгтэй хүн, эмэгтэй хүүхэд, ээж
🗣️	сүүдэр, толгой, ярих, ярьж буй толгой
👤	сүүдэр дүрс, хүний сүүдэр дүрс, цээж
👥	2 сүүдэр, сүүдэр
👣	мөр, улаан, хөл, хөлийн мөр
🦰	улаан шаргал, улаан үс, улаан үстэй толгой
🦱	афро, буржгар, буржгар үс, ороосон үс
🦳	настай, саарал, цагаан, цагаан үс, үс
🦲	халзан, химийн эмчилгээ, үс байхгүй, үсгүй, үсээ хусуулсан
🐵	амьтан, сармагчин, сармагчны толгой, толгой
🐒	амьтан, бие, сармагчин
🦍	амьтан, горилла
🦧	бич, орангутан
🐶	амьтан, нохой, нохойны толгой, толгой
🐕️	амьтан, нохой
🦮	сохор, хараагүй, хөгжлийн бэрхшээл, хөтөч, хөтөч нохой
🐕‍🦺	нохой, туслагч, хөгжлийн бэрхшээл, хөтөч, үйлчлэгч, үйлчлэгч нохой
🐩	амьтан, нохой, пүүдл, пүүдл үүлдрийн нохой, үүлдэр
🐺	нүүр, чоно, чонын толгой
🦊	амьтан, үнэг
🦝	зальжин, сониуч, элбэнх
🐱	амьтан, муур, муурын толгой, толгой
🐈️	амьтан, муур
🦁	амьтан, арслан, арслангийн толгой, толгой
🐯	амьтан, бар, барын толгой, толгой
🐅	амьтан, бар
🐆	амьтан, ирвэс
🐴	амьтан, морины толгой, морь, толгой
🐎	амьтан, морь
🦄	нэг эвэртийн толгой, нүүр
🦓	судалт тахь, тахь
🦌	амьтан, буга
🐮	амьтан, толгой, үнээ, үнээний толгой
🐂	амьтан, шар
🐃	амьтан, бух
🐄	амьтан, үнээ
🐷	амьтан, гахай, гахайны царай, хоншоор
🐖	амьтан, бие, гахай
🐗	амьтан, бодон, бодон гахай, гахай
🐽	амьтан, гахай, гахайны хоншоор, хоншоор, ягаан
🐏	мал, хонины орд, хонь, хуц
🐑	мал, хонь
🐐	мал, ямаа
🐪	бөх, мал, тэмээ
🐫	2 бөхт тэмээ, бөх, мал, тэмээ, хоёр
🦙	алпака лам гөрөөс, викуна лам гөрөөс, гуанако лам гөрөөс, ноос, тэмээн гөрөөс
🦒	анааш, толбо
🐘	амьтан, заан
🦏	амьтан, хирс
🦛	усны үхэр
🐭	амьтан, толгой, хулгана, хулганы толгой
🐁	амьтан, хулгана
🐀	амьтан, харх
🐹	амьтан, толгой, үхэр зусаг, үхэр зусгийн толгой
🐰	амьтан, толгой, туулай, туулайны толгой
🐇	амьтан, туулай
🐿️	амьтан, жирх
🦔	зараа, өргөстэй
🦇	амьтан, сарьсан багваахай
🐻	баавгай, баавгайны толгой, нүүр
🐨	амьтан, баавгай, коала
🐼	амьтан, баавгай, толгой, хулс, хулсны баавгайны толгой
🦥	залхуу, залхууч, удаан
🦦	загас барих ︱ хөгжилтэй, халиу
🦨	өмхий, өмхий хүрнэ
🦘	Австрали, имж, уутат амьтан, цовхрой, үсрэлт
🦡	дорго, залхаах
🐾	савар, саварны мөр, хээ
🦃	талархлын баяр, цацагт хяруул
🐔	амьтан, тахиа, өндөг
🐓	азарган тахиа, амьтан
🐣	дэгдээхэй, хагарах, өндөг
🐤	ангаахай, шувуу
🐥	дэгдээхэй, дэгдээхэй урд талаасаа, тал, урд, өхөөрдөм
🐦️	шувуу
🐧	оцон шувуу
🕊️	нисэх, тагтаа, шувуу, энх тайван
🦅	бүргэд, шувуу
🦆	нугас, шувуу
🦢	залуу хун, нугасны муухай дэгдээхэй, хун, шувуу
🦉	шар шувуу, шувуу
🦩	халуун орон, ягаан, ягаан наль
🦚	бардамнал, гайхуулсан, тогос, шувуу, эм тогос
🦜	далайн дээрэмчин, тоть, шувуу, яриа
🐸	мэлхий, мэлхийний царай, нүүр
🐊	матар
🐢	яст мэлхий
🦎	гүрвэл, хэвлээр явагч
🐍	могой, хэвлээр явагч, өрнийн зурхай
🐲	луу, лууны толгой, толгой
🐉	луу, шидэт үлгэр
🦕	брачиосаурус, бронтосарус, диплодокус, сауропод
🦖	Т-рекс, Тиранозавр рекс
🐳	далай, оргилуулах, ус, ус оргилуулж байгаа халим, халим
🐋	халим
🐬	далайн гахай, сэлүүр
🐟️	загас, загасны орд, өрнийн зурхай
🐠	загас, халуун орны загас, халуун орон
🐡	загас, нохой загас
🦈	акул, загас
🐙	наймаалж
🐚	дун, дунгийн хясаа, хясаа
🐌	эмгэн хумс
🦋	шавьж, эрвээхэй
🐛	хорхой, шавж
🐜	шавж, шоргоолж
🐝	зөгий, шавьж
🐞	цох хорхой, цох шавьж
🦗	хүрэлзгэнэ, царцаа
🕷️	аалз, шавж
🕸️	аалз, аалзны тор, тор
🦂	орд, хилэнц
🦟	вирус, малариа, халуурах, шавьж, шумуул, өвчин
🦠	амёб, бактер, вирус, микроб
💐	баглаа, ургамал, цэцгийн баглаа, цэцэг
🌸	интоор, интоорын цэцэг, ургамал, цэцэг
💮	ургамал, цагаан, цагаан цэцэг, цэцэг
🏵️	Сарнай, сарнай хэлбэртэй чимэглэл, хэлбэр, чимэглэл
🌹	сарнай, ургамал
🥀	хатсан, хатсан цэцэг, цэцэг
🌺	гибискус, гибискус сарнай, сарнай, ургамал
🌻	наран цэцэг, ургамал
🌼	ургамал, цэцэг
🌷	алтан зул, алтан зул цэцэг, ургамал, цэцэг
🌱	ургамал, үрсэлгээ
🌲	гацуур, зул сар, мод, шинэ жил
🌳	мод, навч, навчит мод
🌴	дал, дал мод, мод, ургамал
🌵	кактус, ургамал
🌾	будаа, будааны тариан түрүү, тариан түрүү, үр ургац
🌿	навч, ургамал
☘️	айргана, ургамал
🍀	4, 4 навчтай хошоонгор, навч, ургамал, хошоонгор
🍁	агч, агч модны навч, мод, навч, ургамал
🍂	навч, унаж байгаа навч, унах, ургамал
🍃	навч, салхи, салхинд хийсч буй навч, хийсэх
🍇	жимс, усан үзэм
🍈	гуа, жимс
🍉	жимс, тарвас
🍊	жимс, мандарин
🍋	жимс, лемон, нимбэг, хүчил
🍌	гадил, жимс
🍍	жимс, хан боргоцой
🥭	жимс, манго, халуун орны
🍎	алим, жимс, улаан, улаан алим
🍏	алим, жимс, ногоон, ногоон алим
🍐	жимс, лийр
🍑	жимс, тоор
🍒	жимс, интоор
🍓	гүзээлзгэнэ, жимс
🥝	жимс, киви, киви жимс
🍅	жимс, лооль, улаан, улаан лооль
🥥	дал, наргил
🥑	авокадо, жимс, хүнс
🍆	ногоо, хаш
🥔	ногоо, төмс, хүнс
🥕	лууван, ногоо, хүнс
🌽	навч, ургамал, шош, шошны навч
🌶️	ургамал, халуун, халуун чинжүү, чинжүү
🥒	ногоо, хүнс, өргөст хэмх
🥬	байцаа, буржгар байцаа, навчит ногоо, ногоон навч, юуцай
🥦	зэрлэг цэцэгт байцаа, цэцэгт байцаа
🧄	амтлагч, саримс
🧅	амтлагч, сонгино
🍄	мөөг, ургамал
🥜	газрын самар, ногоо, хүнс
🌰	каштан, самар
🍞	талх, хүнс
🥐	ороомог талх, талх, франц, хүнс
🥖	багет, багет франц талх, талх, франц, хүнс
🥨	ороомог, претцел
🥯	нарийн боовны газар, түрхэх, цагирган талх
🥞	бин, хүнс
🧇	вафль, ширэм
🧀	бяслаг, зүсэм, зүсэм бяслаг, хүнс
🍖	мах, яс, ястай мах
🍗	мах, тахиан шарсан мөч, хөл, шувуу
🥩	гахайн хэрчим мах, зүсэм мах, стейк, хонины хэрчим мах, хэрчим мах
🥓	гахайн мах, мах, хүнс
🍔	бургер, гамбургер
🍟	төмс, шарах, шарсан төмс
🍕	бяслаг, зүсэм, пицца
🌭	зайдас, хот-дог
🥪	сэндвич, талх
🌮	мексик, тако
🌯	буррито, мексик
🥙	кебаб, хавчуургатай ороомог, хүнс
🧆	бөөрөнхий мах, бөөрөнцөг, фалафель, шош
🥚	хүнс, өндөг
🍳	хайруулын таваг, шарах, өндөг, өндөг шарах
🥘	тогоо, тогоотой хоол, хайруулын таваг, хоол
🍲	тогоо сав, хоолтой тогоо
🥣	буудай, халбагатай сав, өглөөний цай
🥗	ногоо, ногооны салат, салат, хүнс
🍿	попкорн
🧈	цагаан идээ, цөцгийн тос
🧂	давс, сэгсрэгч, хоол амтлагч
🥫	лааз, лаазтай хоол
🍱	сав, өдрийн хоол
🍘	будаа, будааны жигнэмэг, жигнэмэг
🍙	будаа, будааны ороомог, ороомог
🍚	агшаасан будаа, агшаах, будаа
🍛	будаа, карри, карритай будаа
🍜	гоймон, чанасан гоймон, чанах
🍝	паста, шпагетти
🍠	төмс, чихэрлэг, шарсан, шарсан чихэрлэг төмс
🍢	далайн гаралтай хоол, иш, кебаб, удэн, шорлог
🍣	суши
🍤	далайн хоол, дэгээ, сам хорхой, шарсан, шарсан сам хорхой
🍥	бялуу, загас, загасны бялуу
🥮	yuèbǐng, баяр, намар, саран боов
🍡	данго, япон
🥟	бууз, жигнэсэн банш, шарсан банш
🥠	азын жигнэмэг, иш
🥡	авч явах, эмгэн хумс
🦀	хавч, хилэнц, өрнийн зурхай
🦞	голын хавч, далайн хоол, сарвуу, хавчны зутан шөл
🦐	жижиг, сам хорхой, усны амьтан, хавч, хүнс
🦑	кальмар, наймаалж, усны амьтан
🦪	сувд, хясаа
🍦	амттан, мөхөөлдөс, шинэхэн, шинэхэн мөхөөлдөс
🍧	амттан, мөс, хөлдөөсөн, хөлдөөсөн мөс
🍨	амттан, мөхөөлдөс
🍩	амттан, боов, хайрсан, хайрсан нарийн боов
🍪	амттан, жигнэмэг
🎂	бялуу, лаа, тэмдэглэлт өдөр, төрсөн өдрийн бялуу, төрсөн өдөр
🍰	амттан, бялуу, бялууны зүсэм, зүсэм
🧁	амттан, аяган кекс, нарийн боовны газар
🥧	зүсэм бялуу, нарийн боов
🍫	амттан, шоколад
🍬	амттан, чихэр
🍭	амттан, иш, иштэй чихэр, чихэр
🍮	амттан, кастард
🍯	бал, зөгий, зөгийн балны сав, сав
🍼	сав, сүү, хүүхдийн сүүний сав, хүүхэд
🥛	аяга, аяга сүү, сүү, унд
☕️	зүйл, уух, халуун, халуун уух зүйл
🍵	аяга, бариул, бариулгүй цайны аяга, уух, цай
🍶	сакэ, уух, шил
🍾	буудах, дарс, оргилуун, оргилуун дарс, уух
🍷	вино, виноны хундага, уух, хундага, шил
🍸️	коктэйл, уух, хундага, шил
🍹	баар, жимсний ундаа, уух юм, халуун орны
🍺	аяга, уух, шар айраг
🍻	тулгаж буй шар айрагны хундага, тулгах, уух, хундага, шар айраг
🥂	баяр тэмдэглэх, тулгах, уух, хундага, хундага тулгах
🥃	архи, архины жүнз, виски, дарс, жүнз
🥤	жүүс, сода, соруултай аяга
🧃	ундааны хайрцаг, шүүсний хайрцаг
🧉	матэ, унд
🧊	мөс, мөсөн уул, хүйтэн
🥢	савх
🍽️	сэрээ, таваг, таваг, хутга сэрээ, хоол, хутга
🍴	сэрээ, хоол, хутга, хутга сэрээ
🥄	халбага, ширээний хэрэгсэл
🔪	гал тогоо, гал тогооны хутга, хутга
🏺	Хумх, бумба, зурхай, уух юм, хоол хийх
🌍	африк, бөмбөрцөг, дэлхий, европ, европ африкийг харуулсан бөмбөрцөг
🌎️	америк, америкийг харуулсан бөмбөрцөг, бөмбөрцөг, дэлхий, харуулах
🌏	австрали, ази, ази-австралийг харуулсан бөмбөрцөг, бөмбөрцөг, дэлхий, харуулах
🌐	бөмбөрцөг, дэлхий, зураас, уртраг, уртраг, өргөргийн зураастай бөмбөрцөг, өргөрөг
🗺️	газар, дэлхий, дэлхийн газрын зураг, зураг
🗾	газрын зураг, япон, япон улсын газрын зураг
🧭	луужин, навигаци, соронз, чиглүүлэх
🏔️	уул, хүйтэн, цас, цаст уул
⛰️	уул
🌋	галт, галт уул, уул, цаг агаар
🗻	уул, фүжи, фүжи уул
🏕️	аялал, майхан, хээр хонох
🏖️	далай, далайн эрэг, зоонтог, элс, эрэг
🏜️	кактус, цөл, элс
🏝️	арал, дал мод, далай
🏞️	ус, үндэсний цэцэрлэгт хүрээлэн
🏟️	цэнгэлдэх хүрээлэн
🏛️	барилга, сонгодог, сонгодог барилга
🏗️	барилга, барилга угсралт, угсралт
🧱	зуурмаг, тоосго, хана, шавар
🏘️	байшин, байшингийн барилга, барилга
🏚️	байшин, балгас
🏠️	байшин, гэр, давхар
🏡	байшин, гэр, мод, цэцэрлэг, цэцэрлэгтэй байшин
🏢	барилга, оффис, оффисын барилга
🏣	барилга, шуудан, япон, японы шуудан
🏤	барилга, европ, шуудан
🏥	барилга, эмнэлэг, эмч
🏦	банк, барилга
🏨	байшин, барилга, зочид буудал
🏩	барилга, зочид буудал, хайр, хайрын зочид буудал
🏪	24, 24 цагийн дэлгүүр, барилга, дэлгүүр, цаг
🏫	барилга, сургууль
🏬	барилга, их дэлгүүр
🏭️	барилга, үйлдвэр
🏯	барилга, ордон, япон, японы ордон
🏰	европ, ордон
💒	хайр дурлал, хурим
🗼	токио, токио цамхаг, цамхаг
🗽	хөшөө, эрх чөлөө, эрх чөлөөний хөшөө
⛪️	загалмай, сүм, христ, шашин
🕌	бурхан, лалын сүм, мөргөл, шашин, шинто
🛕	сүм, хиндү, хиндү сүм
🕍	жүүдийн сүм, шашин
⛩️	бурхны газар, шашин
🕋	ислам, кааба, муслим, шашин
⛲️	оргилуур, ус, усан оргилуур
⛺️	зугаалга, майхан
🌁	манан, манантай, цаг агаар
🌃	од, одтой шөнө, шөнө
🏙️	барилга, хот
🌄	дээгүүр, мандах, нар, толгод, уул, уулын толгод дээгүүр нар мандах
🌅	мандах, нар, нар мандах
